{
  "$schema": "../../schemas/solution-release.schema.json",
  "schema_version": "1.2.0",
  "release_id": "invoice_exception_reference_release",
  "version": "3.1.0",
  "release_status": "review",
  "release_digest": "sha256:8e21e2fd5b414fd3540be48e3adde02d11feb757e632cee00bcf4a2286f3017c",
  "owner": "reference-release-maintainer",
  "created_at": "2026-08-07T18:00:00Z",
  "workflow_charter_uri": "workflow-charter.json",
  "agent_system_uri": "agent-system.json",
  "evaluation_report_uri": "evaluation-report.json",
  "target_segments": [
    "policy-covered invoice exceptions"
  ],
  "autonomy_level": "execute_reversible",
  "artifacts": [
    {
      "role": "workflow_charter",
      "uri": "workflow-charter.json",
      "version": "0.1.0",
      "schema_version": "1.2.0",
      "digest": "sha256:9565fbd85246295cf572f37d14cdb6d2692566deb72a89c7b660894498da6c91",
      "change_summary": "Bind the bounded pilot charter and value decision."
    },
    {
      "role": "data_context",
      "uri": "data-context-manifest.json",
      "version": "1.0.0",
      "schema_version": "1.0.0",
      "digest": "sha256:adfd7f70e70dac39528f5766f5992a217612cbbb28f8183cc208d5d0b5d85f56",
      "change_summary": "Bind the four data planes, decision-critical quality, preparation lineage, and operating contract."
    },
    {
      "role": "domain_model",
      "uri": "ontology.json",
      "version": "1.0.0",
      "schema_version": "1.1.0",
      "digest": "sha256:1b67999af7ad2f7296f90a2aa93ad75e2fbedf62f05f023a228f4b384c3e59cd",
      "change_summary": "Bind the operational invoice, policy, proposal, and effect model."
    },
    {
      "role": "agent_system",
      "uri": "agent-system.json",
      "version": "3.0.0",
      "schema_version": "1.2.0",
      "digest": "sha256:682b9cb4519a10df1b585f51fac05d95d5ddb1dc9c3ebf5b58948fb6441db012",
      "change_summary": "Bind the exact workflow topology, authority, and behavior contract."
    },
    {
      "role": "behavior_bundle",
      "uri": "behavior-bundle.json",
      "version": "3.0.0",
      "schema_version": "1.0.0",
      "digest": "sha256:ebe51e05f22df7ffe48461f4d6d761a4808cfd985f0a8eae5e32294da0a85d25",
      "change_summary": "Bind the exact runtime, policy, tool, and capability component graph."
    },
    {
      "role": "tool_contract",
      "uri": "tools/read-invoice.json",
      "version": "2.0.0",
      "schema_version": "1.1.0",
      "digest": "sha256:8e39ddea00848c41cc26ef88ff78ca5365828552c71bdf07a8d5c7e911722cd6",
      "change_summary": "Bind the exact authorized invoice read contract."
    },
    {
      "role": "tool_contract",
      "uri": "tools/retrieve-policy.json",
      "version": "3.0.0",
      "schema_version": "1.1.0",
      "digest": "sha256:1cae7b5e9bf71462acc9fd83f510e66c3370d5f9e165f89e23085e50ef865437",
      "change_summary": "Bind the exact tenant-scoped policy read contract."
    },
    {
      "role": "tool_contract",
      "uri": "tools/stage-resolution.json",
      "version": "3.0.0",
      "schema_version": "1.1.0",
      "digest": "sha256:75a3e64646455056bafda9bdca57812b5cf9be8fe7e4075c1230259f24408139",
      "change_summary": "Bind the exact staged proposal contract."
    },
    {
      "role": "tool_contract",
      "uri": "tools/commit-resolution.json",
      "version": "3.0.0",
      "schema_version": "1.1.0",
      "digest": "sha256:6aa7a9e0f333683b964c71a2f5dc6c8cf97a3e07ed9243adc0a3e828dc36a2f1",
      "change_summary": "Bind the exact idempotent commit contract."
    },
    {
      "role": "tool_contract",
      "uri": "tools/readback-invoice-effect.json",
      "version": "2.0.0",
      "schema_version": "1.1.0",
      "digest": "sha256:b86413b438a24b6f118024177938ef75a8a7a979aa3623188efbb7c00f67caec",
      "change_summary": "Bind the exact source-of-truth effect readback contract."
    },
    {
      "role": "capability_manifest",
      "uri": "capabilities/read-invoice.json",
      "version": "2.0.0",
      "schema_version": "1.1.0",
      "digest": "sha256:a9011198868363cae1dc628433cd3857a4dbeeb8b3f5be45d6b5c3cddf1d833d",
      "change_summary": "Bind the candidate invoice-read build and authority projection."
    },
    {
      "role": "capability_manifest",
      "uri": "capabilities/retrieve-policy.json",
      "version": "3.0.0",
      "schema_version": "1.1.0",
      "digest": "sha256:a932fc6c01a1b63f1e8ca2d9cc1018855953dfac9e2385e8472358615380052e",
      "change_summary": "Bind the candidate policy-read build and authority projection."
    },
    {
      "role": "capability_manifest",
      "uri": "capabilities/stage-resolution.json",
      "version": "3.0.0",
      "schema_version": "1.1.0",
      "digest": "sha256:baf9cf8048dcaa50d896e3672de7cf7df2b23d3eb8b77d9677cb2a646173e6f7",
      "change_summary": "Bind the candidate staging build and authority projection."
    },
    {
      "role": "capability_manifest",
      "uri": "capabilities/commit-resolution.json",
      "version": "3.0.0",
      "schema_version": "1.1.0",
      "digest": "sha256:4e095d34d630fa8b382c94722b91bc33569f3e38a6348a472da321d2f81c2670",
      "change_summary": "Bind the candidate commit build and authority projection."
    },
    {
      "role": "capability_manifest",
      "uri": "capabilities/readback-invoice-effect.json",
      "version": "2.0.0",
      "schema_version": "1.1.0",
      "digest": "sha256:239f8bbd8363c704200be5e01fe9a11cc6a20b83af42211f415a137746675601",
      "change_summary": "Bind the candidate readback build and authority projection."
    },
    {
      "role": "security_policy",
      "uri": "authorization-policy.mjs",
      "version": null,
      "schema_version": null,
      "digest": "sha256:2be7af642c7e4ed5fcd0e3a18c576ed4e4c6877525967b07286b65efa46c64b2",
      "change_summary": "Bind executable caller, tenant, scope, effect, and data-access authorization."
    },
    {
      "role": "threat_model",
      "uri": "threat-model.json",
      "version": null,
      "schema_version": "1.0.0",
      "digest": "sha256:2efd68fa435971eef94a2eb467357f6bb2031bc3ac7bdb7c43a9ea903c1637cb",
      "change_summary": "Bind threat paths to executable negative cases."
    },
    {
      "role": "evaluation",
      "uri": "evaluation-report.json",
      "version": "2.0.0",
      "schema_version": "1.1.0",
      "digest": "sha256:8acf3f1294ff234c5480c61806c59acbdc2b6fe67636c48de13648f1b5c5ffb5",
      "change_summary": "Bind the isolated deterministic regression claim and raw runner evidence."
    },
    {
      "role": "runtime",
      "uri": "reference-loop.mjs",
      "version": "3.0.0",
      "schema_version": null,
      "digest": "sha256:1e528dd3191ff7b0abc3c44b01235a100cfc47ceac414aed3223390a94f54b5d",
      "change_summary": "Bind the exact bounded state-machine runtime under review."
    },
    {
      "role": "user_surface",
      "uri": "README.md",
      "version": null,
      "schema_version": null,
      "digest": "sha256:6b706b3cde259f7ad26d74895205b5e05a3250a108e887d531efae7e22d55c12",
      "change_summary": "Bind the documented operator-facing reference workflow."
    },
    {
      "role": "operations",
      "uri": "../../operations/incident-runbook.md",
      "version": null,
      "schema_version": null,
      "digest": "sha256:497d8c159c86a1db766b86d69c05cab8fe57e7a3bb22a257da8aef97eec97a86",
      "change_summary": "Bind the incident, containment, recovery, and evidence procedure."
    }
  ],
  "compatibility": {
    "environment_id": "local-reference-host-process",
    "migration_required": true,
    "migrations": [
      "Upgrade callers to the v3 commit contract with readback authority and approval chronology.",
      "Supply run_id, readback_request_id, and requested_at to the v2 signed readback request."
    ],
    "known_incompatibilities": [
      "Prior tool-contract and capability-manifest versions are not compatible with this release packet.",
      "Teaching fixture only; no production identity, registry, sandbox, or service deployment is asserted."
    ],
    "verification": [
      "Run the governed repository validator and the exact invoice evaluation runner before review."
    ]
  },
  "rollout": {
    "strategy": "shadow",
    "traffic_percent": 0,
    "soak_seconds": 86400,
    "success_criteria": [
      "Every bound deterministic case passes with zero unauthorized, duplicate, or unverified effects."
    ],
    "rollback_criteria": [
      "Any prohibited effect, integrity mismatch, or missing source-of-truth readback stops the fixture."
    ],
    "kill_switch": "invoice-reference-runtime-deny",
    "rollback_owner": "agent-platform",
    "service_owner": "accounts-payable-service"
  },
  "approvals": [],
  "deployment_evidence": null,
  "rollback_evidence": null,
  "retirement_evidence": null,
  "control_ids": [
    "DEL-001",
    "DEL-002",
    "TOL-002",
    "TOL-006",
    "SEC-007",
    "EVA-002",
    "EVA-006",
    "ADP-002",
    "OPS-007"
  ]
}
